<?xml version="1.0" encoding="ISO-8859-1"?><semanticNet xmlns:xsi="http://www.w3.org/2001/XMLSchema-instance" xsi:noNamespaceSchemaLocation="semanticNetv3.xsd">	<dataSource>	<dynamic>false</dynamic>		<class>edu.xtec.merli.semanticnet.nouDataSourceTHJDBC</class>		<relations>		<relationType>MT</relationType>		<relationType>BT</relationType>		<relationType>RT</relationType>		<relationType>USE</relationType>		<relationType>UF</relationType>		<relationType>RBT</relationType>		<relationType>OT</relationType>		</relations>		<nodes>		<nodeType>thesaurus</nodeType>		</nodes>	</dataSource>	<dataSource>		<dynamic>false</dynamic>		<class>edu.xtec.merli.semanticnet.nouDataSourceSNJDBC</class>		<relations>		<relationType>RCL</relationType>		<relationType>RCA</relationType>		<relationType>RCC</relationType>		<relationType>ROL</relationType>		<relationType>ROA</relationType>		<relationType>RAL</relationType>		<relationType>RLL</relationType>		<relationType>RH</relationType>		<relationType>RN</relationType>		<relationType>RET</relationType>		</relations>		<nodes>		<nodeType>level</nodeType>		<nodeType>area</nodeType>		<nodeType>objective</nodeType>		<nodeType>content</nodeType>		<nodeType>notes</nodeType>		<nodeType>history</nodeType>		</nodes>	</dataSource>	<relations>		<relation>			<type>RT</type>			<properties>				<property>					<name>class</name>					<value>edu.xtec.merli.semanticnet.elements.CurriculumRelation</value>				</property>			</properties>		</relation>		<relation>			<type>MT</type>			<properties>				<property>					<name>class</name>					<value>edu.xtec.merli.semanticnet.elements.CurriculumRelation</value>				</property>			</properties>		</relation>		<relation>			<type>BT</type>			<properties>				<property>					<name>class</name>					<value>edu.xtec.merli.semanticnet.elements.CurriculumRelation</value>				</property>			</properties>		</relation>		<relation>			<type>USE</type>			<properties>				<property>					<name>class</name>					<value>edu.xtec.merli.semanticnet.elements.CurriculumRelation</value>				</property>			</properties>		</relation> 		<relation>			<type>UF</type>			<properties>				<property>					<name>class</name>					<value>edu.xtec.merli.semanticnet.elements.CurriculumRelation</value>				</property>			</properties>		</relation> 		<relation>			<type>RBT</type>			<properties>				<property>					<name>class</name>					<value>edu.xtec.merli.semanticnet.elements.CurriculumRelation</value>				</property>			</properties>		</relation>		<relation>			<type>OT</type>			<properties>				<property>					<name>class</name>					<value>edu.xtec.merli.semanticnet.elements.CurriculumRelation</value>				</property>			</properties>		</relation><relation>			<type>RCL</type>			<description>Relations objective Content</description>			<properties>				<property>					<name>class</name>					<value>edu.xtec.merli.semanticnet.elements.CurriculumRelation</value>				</property>			</properties>		</relation>		<relation>			<type>RCA</type>			<description>Related area-content</description>			<properties>				<property>					<name>class</name>					<value>edu.xtec.merli.semanticnet.elements.CurriculumRelation</value>				</property>			</properties>		</relation>		<relation>			<type>RCC</type>			<description>Related content-content</description>			<properties>				<property>					<name>class</name>					<value>edu.xtec.merli.semanticnet.elements.CurriculumRelation</value>				</property>			</properties>		</relation>		<relation>			<type>ROL</type>			<description>Relations level objective</description>			<properties>				<property>					<name>class</name>					<value>edu.xtec.merli.semanticnet.elements.CurriculumRelation</value>				</property>			</properties>		</relation>		<relation>			<type>ROA</type>			<description>Relations area-objective</description>			<properties>				<property>					<name>class</name>					<value>edu.xtec.merli.semanticnet.elements.CurriculumRelation</value>				</property>			</properties>		</relation>		<relation>			<type>RAL</type>			<description>Relations level-area</description>			<properties>				<property>					<name>class</name>					<value>edu.xtec.merli.semanticnet.elements.CurriculumRelation</value>				</property>			</properties>		</relation>		<relation>			<type>RLL</type>			<description>Relations level-level</description>			<properties>				<property>					<name>class</name>					<value>edu.xtec.merli.semanticnet.elements.CurriculumRelation</value>				</property>			</properties>		</relation>		<relation>			<type>RH</type>			<description>Related history</description>			<properties>				<property>					<name>class</name>					<value>edu.xtec.merli.semanticnet.elements.CurriculumRelation</value>				</property>			</properties>		</relation>		<relation>			<type>RN</type>			<description>Related Notes, observations</description>			<properties>				<property>					<name>class</name>					<value>edu.xtec.merli.semanticnet.elements.CurriculumRelation</value>				</property>			</properties>		</relation>		<relation>			<type>RET</type>			<description>relation curriculum element - thesaurus</description>			<properties>				<property>					<name>class</name>					<value>edu.xtec.merli.semanticnet.elements.CurriculumRelation</value>				</property>			</properties>		</relation>	</relations>	<nodes>		<node>			<type>level</type>			<properties>				<property>					<name>class</name>					<value>edu.xtec.merli.semanticnet.elements.CurriculumNode</value>				</property>			</properties>		</node>		<node>			<type>area</type>			<properties>				<property>					<name>class</name>					<value>edu.xtec.merli.semanticnet.elements.CurriculumNode</value>				</property>			</properties>		</node>		<node>			<type>content</type>			<properties>				<property>					<name>class</name>					<value>edu.xtec.merli.semanticnet.elements.CurriculumNode</value>				</property>			</properties>		</node>		<node>			<type>objective</type>			<properties>				<property>					<name>class</name>					<value>edu.xtec.merli.semanticnet.elements.CurriculumNode</value>				</property>			</properties>		</node>		<node>			<type>history</type>			<properties>				<property>					<name>class</name>					<value>edu.xtec.merli.semanticnet.elements.CurriculumNode</value>				</property>			</properties>		</node>		<node>			<type>notes</type>			<properties>				<property>					<name>class</name>					<value>edu.xtec.merli.semanticnet.elements.CurriculumNode</value>				</property>			</properties>		</node>		<node>			<type>thesaurus</type>			<properties>				<property>					<name>class</name>					<value>edu.xtec.semanticnet.thesaurus.NodeTypeThesaurus</value>				</property>			</properties>		</node>	</nodes></semanticNet>